{"type":"config","name":"lbrdiv-6-team","metricName":"composite","metricUnit":"jsd*sp","bestDirection":"higher"}
{"run":1,"commit":"5ac76be","metric":0.0,"metrics":{"mean_jsd":0.314,"min_jsd":0.171,"min_sp_return":0.0,"mean_sp_return":0.188,"n_collapsed":3,"mean_agreement":0.221},"status":"keep","description":"baseline: 6 teams default params 15M steps — 3/6 collapsed","timestamp":1779075610,"segment":0}
{"run":2,"commit":"5ac76be","metric":0.0,"metrics":{"mean_jsd":0.093,"min_jsd":0.078,"min_sp_return":0.0,"mean_sp_return":0.019,"n_collapsed":6,"mean_agreement":0.268},"status":"discard","description":"ENT_COEF=0.05 — all 6 teams collapsed, entropy too high","timestamp":1779076190,"segment":0}
{"run":3,"commit":"5ac76be","metric":0.0,"metrics":{"mean_jsd":0.348,"min_jsd":0.149,"min_sp_return":0.0,"mean_sp_return":0.207,"n_collapsed":3,"mean_agreement":0.307},"status":"discard","description":"NUM_ENVS=128 — still 3 collapsed, secondary metrics improved but primary unchanged","timestamp":1779076848,"segment":0}
{"type":"config","name":"lbrdiv-6-team","metricName":"composite","metricUnit":"jsd*mean_sp","bestDirection":"higher"}
{"run":4,"commit":"f06103f","metric":0.079,"metrics":{"mean_jsd":0.306,"min_jsd":0.221,"min_sp_return":0.0,"mean_sp_return":0.257,"n_collapsed":1,"mean_agreement":0.288},"status":"keep","description":"LAGRANGE_LR=0.001 — 1 collapsed (br_3), best so far","timestamp":1779077510,"segment":1}
{"run":5,"commit":"6845e48","metric":0.194,"metrics":{"mean_jsd":0.472,"min_jsd":0.307,"min_sp_return":0.167,"mean_sp_return":0.411,"n_collapsed":0,"mean_agreement":0.376},"status":"keep","description":"LAGRANGE_LR=0.001 + NUM_ENVS=128 — all 6 survived! Goal achieved","timestamp":1779078023,"segment":1}
{"run":6,"commit":"6845e48","metric":0.155,"metrics":{"mean_jsd":0.396,"min_jsd":0.285,"min_sp_return":0.267,"mean_sp_return":0.392,"n_collapsed":0,"mean_agreement":0.326},"status":"discard","description":"25M timesteps — teams converge to similar behaviors, JSD falls to 0.396 (was 0.472 at 15M)","timestamp":1779107012,"segment":1}
{"run":7,"commit":"b9c71bf","metric":0.260,"metrics":{"mean_jsd":0.525,"min_jsd":0.247,"min_sp_return":0.483,"mean_sp_return":0.496,"n_collapsed":0,"mean_agreement":0.360},"status":"keep","description":"CLIP_EPS=0.2 — all 6 near-optimal SP, highest JSD yet","timestamp":1779107526,"segment":1}
{"run":8,"commit":"b9c71bf","metric":0.250,"metrics":{"mean_jsd":0.518,"min_jsd":0.188,"min_sp_return":0.450,"mean_sp_return":0.482,"n_collapsed":0,"mean_agreement":0.394},"status":"discard","description":"LAGRANGE_LR=0.0005 — too slow, tight right/up clusters, min_jsd=0.188","timestamp":1779108079,"segment":1}
{"run":9,"commit":"b9c71bf","metric":0.232,"metrics":{"mean_jsd":0.541,"min_jsd":0.150,"min_sp_return":0.233,"mean_sp_return":0.429,"n_collapsed":0,"mean_agreement":0.351},"status":"discard","description":"TRAIN_SEED=0 — all survived but br_1/br_3 cluster to near-identical right-go (JSD=0.15)","timestamp":1779108598,"segment":1}
{"run":10,"commit":"b9c71bf","metric":0.216,"metrics":{"mean_jsd":0.545,"min_jsd":0.365,"min_sp_return":0.0,"mean_sp_return":0.396,"n_collapsed":1,"mean_agreement":0.305},"status":"discard","description":"TOLERANCE_FACTOR=0.2 — best diversity ever (min_jsd=0.365) but br_1 collapsed","timestamp":1779109124,"segment":1}
{"run":11,"commit":"b9c71bf","metric":0.189,"metrics":{"mean_jsd":0.421,"min_jsd":0.186,"min_sp_return":0.325,"mean_sp_return":0.450,"n_collapsed":0,"mean_agreement":0.526},"status":"discard","description":"TOLERANCE_FACTOR=0.15 — 5/6 teams cluster to up-go, low diversity, non-monotonic","timestamp":1779109634,"segment":1}
{"run":12,"commit":"b9c71bf","metric":0.241,"metrics":{"mean_jsd":0.506,"min_jsd":0.334,"min_sp_return":0.458,"mean_sp_return":0.475,"n_collapsed":0,"mean_agreement":0.382},"status":"discard","description":"LAGRANGE_LR=0.002 — n_collapsed=0, min_jsd=0.334 (better floor than best), slightly lower composite","timestamp":1779110142,"segment":1}
{"run":13,"commit":"b9c71bf","metric":0.158,"metrics":{"mean_jsd":0.503,"min_jsd":0.321,"min_sp_return":0.0,"mean_sp_return":0.314,"n_collapsed":1,"mean_agreement":0.302},"status":"discard","description":"LR=1e-3 — br_0 collapsed, faster LR destabilizes","timestamp":1779110662,"segment":1}
{"run":14,"commit":"b9c71bf","metric":0.228,"metrics":{"mean_jsd":0.457,"min_jsd":0.263,"min_sp_return":0.500,"mean_sp_return":0.500,"n_collapsed":0,"mean_agreement":0.452},"status":"discard","description":"ROLLOUT_LENGTH=256 — all 6 at max SP (0.50!) but less diversity, lower JSD","timestamp":1779111333,"segment":1}
{"run":15,"commit":"b9c71bf","metric":0.229,"metrics":{"mean_jsd":0.458,"min_jsd":0.196,"min_sp_return":0.500,"mean_sp_return":0.500,"n_collapsed":0,"mean_agreement":0.419},"status":"discard","description":"ANNEAL_LR=true — all 6 at max SP (0.50!) but br_1/br_2 cluster (JSD=0.196, agree=73%)","timestamp":1779111923,"segment":1}
{"run":16,"commit":"7b24dc8","metric":0.264,"metrics":{"mean_jsd":0.529,"min_jsd":0.181,"min_sp_return":0.500,"mean_sp_return":0.500,"n_collapsed":0,"mean_agreement":0.380},"status":"keep","description":"NUM_ENVS=192 — all 6 at max SP, new best composite","timestamp":1779112434,"segment":1}
{"run":17,"commit":"7b24dc8","metric":0.219,"metrics":{"mean_jsd":0.438,"min_jsd":0.120,"min_sp_return":0.500,"mean_sp_return":0.500,"n_collapsed":0,"mean_agreement":0.503},"status":"discard","description":"NUM_ENVS=256 — severe over-convergence, 4/6 in go-up cluster (JSD=0.120)","timestamp":1779112923,"segment":1}
{"run":18,"commit":"7b24dc8","metric":0.0,"metrics":{"mean_jsd":0.0,"min_jsd":0.0,"min_sp_return":0.0,"mean_sp_return":0.0,"n_collapsed":6,"mean_agreement":1.0},"status":"crash","description":"12x12 grid 6-food 25M — diagnostic crashed: obs_dim mismatch (15 vs 24), fixed --env-kwargs passthrough","timestamp":1779113561,"segment":1}
{"run":18,"commit":"7b24dc8","metric":0.020,"metrics":{"mean_jsd":0.376,"min_jsd":0.133,"min_sp_return":0.000,"mean_sp_return":0.052,"n_collapsed":4,"mean_agreement":0.242},"status":"discard","description":"12x12 grid 6-food force_coop 25M — too hard, 4/6 collapsed, SP never learned","timestamp":1779114231,"segment":1}
{"run":19,"commit":"7b24dc8","metric":0.209,"metrics":{"mean_jsd":0.419,"min_jsd":0.307,"min_sp_return":0.500,"mean_sp_return":0.500,"n_collapsed":0,"mean_agreement":0.513},"status":"discard","description":"different_levels small env — SP-XP gap=0.007, XP trivially easy, diversity pressure gone","timestamp":1779114792,"segment":1}
{"run":20,"commit":"7b24dc8","metric":0.088,"metrics":{"mean_jsd":0.518,"min_jsd":0.376,"min_sp_return":0.073,"mean_sp_return":0.170,"n_collapsed":0,"mean_agreement":0.331},"status":"discard","description":"large env 12x12 6-food different_levels 45M — best diversity ever (min_jsd=0.376) but SP too low (mean=0.170), still learning","timestamp":1779115806,"segment":1}
{"run":21,"commit":"7b24dc8","metric":0.076,"metrics":{"mean_jsd":0.516,"min_jsd":0.338,"min_sp_return":0.063,"mean_sp_return":0.147,"n_collapsed":0,"mean_agreement":0.353},"status":"discard","description":"large env 75M — worse than 45M! SP regressed (0.170→0.147), Lagrange fights SP after 45M sweet spot","timestamp":1779117258,"segment":1}
{"run":22,"commit":"7b24dc8","metric":0.118,"metrics":{"mean_jsd":0.521,"min_jsd":0.353,"min_sp_return":0.182,"mean_sp_return":0.226,"n_collapsed":0,"mean_agreement":0.389},"status":"discard","description":"large env 45M LAGRANGE_LR=0.0001 — SP improved (mean_sp=0.226) vs 0.001 but SP-XP gap=0.040, composite still low","timestamp":1779118336,"segment":1}
{"run":23,"commit":"7b24dc8","metric":0.094,"metrics":{"mean_jsd":0.505,"min_jsd":0.326,"min_sp_return":0.100,"mean_sp_return":0.186,"n_collapsed":0,"mean_agreement":0.353},"status":"discard","description":"large env 45M LAGRANGE_LR=0.0005 — non-monotonic, 0.0001 is better on both composite and min_jsd","timestamp":1779119311,"segment":1}
{"run":24,"commit":"7b24dc8","metric":0.127,"metrics":{"mean_jsd":0.508,"min_jsd":0.386,"min_sp_return":0.180,"mean_sp_return":0.250,"n_collapsed":0,"mean_agreement":0.371},"status":"discard","description":"large env 60M LAGRANGE_LR=0.0001 — both SP and diversity still improving vs 45M, trend positive","timestamp":1779120500,"segment":1}
{"run":25,"commit":"7b24dc8","metric":0.101,"metrics":{"mean_jsd":0.496,"min_jsd":0.393,"min_sp_return":0.187,"mean_sp_return":0.204,"n_collapsed":0,"mean_agreement":0.387},"status":"discard","description":"large env 75M LAGRANGE_LR=0.0001 — regressed from 60M (mean_sp 0.250→0.204), 60M is the sweet spot","timestamp":1779121957,"segment":1}
{"run":26,"commit":"7b24dc8","metric":0.100002,"metrics":{"mean_jsd":0.454842,"min_jsd":0.326517,"min_sp_return":0.173333,"mean_sp_return":0.219861,"n_collapsed":0,"mean_agreement":0.475000},"status":"discard","description":"large env 75M LAGRANGE_LR=0.00005 — SP slightly better than 0.0001@75M (0.220 vs 0.204) but JSD falls more; 0.0001@60M still best","timestamp":1779124689,"segment":1}
{"run":27,"commit":"7b24dc8","metric":0.094415,"metrics":{"mean_jsd":0.447231,"min_jsd":0.320324,"min_sp_return":0.187500,"mean_sp_return":0.211111,"n_collapsed":0,"mean_agreement":0.486198},"status":"discard","description":"TOLERANCE_FACTOR=0.05 — SP-XP gap collapsed to 0.019, no differentiation signal, teams cluster, min_jsd=0.320","timestamp":1779125893,"segment":1}
{"run":28,"commit":"7b24dc8","metric":0.096115,"metrics":{"mean_jsd":0.551854,"min_jsd":0.404298,"min_sp_return":0.090000,"mean_sp_return":0.174167,"n_collapsed":0,"mean_agreement":0.297396},"status":"discard","description":"TOLERANCE_FACTOR=0.2 — best diversity ever (min_jsd=0.404, mean_jsd=0.552) but SP tanks (mean_sp=0.174), br_4 near-collapsed (entropy=0.932); tolerance tradeoff mapped, 0.1 is optimal","timestamp":1779127105,"segment":1}
{"run":29,"commit":"7b24dc8","metric":0.097535,"metrics":{"mean_jsd":0.402899,"min_jsd":0.269823,"min_sp_return":0.148333,"mean_sp_return":0.242083,"n_collapsed":0,"mean_agreement":0.544792},"status":"discard","description":"NUM_ENVS=256 large env — over-convergence: br_1/br_3 agree 78.5%, min_jsd=0.270; 192 is optimal for both small and large env","timestamp":1779128247,"segment":1}
{"run":30,"commit":"f480719","metric":0.150076,"metrics":{"mean_jsd":0.487392,"min_jsd":0.209053,"min_sp_return":0.254167,"mean_sp_return":0.307917,"n_collapsed":0,"mean_agreement":0.432292},"status":"keep","description":"LR=3e-4 — new best! mean_sp=0.308 (+23% vs LR=5e-4), composite=0.150; two behavioral clusters (br0/1/2 down-left, br4/5 up-right) but all SP>=0.254","timestamp":1779129457,"segment":1}
{"run":31,"commit":"e10bbe4","metric":0.154462,"metrics":{"mean_jsd":0.519201,"min_jsd":0.267105,"min_sp_return":0.255833,"mean_sp_return":0.297500,"n_collapsed":0,"mean_agreement":0.395052},"status":"keep","description":"LR=3e-4 75M — new best composite=0.154, mean_jsd improved (0.487→0.519), two clusters (down/up) but between-cluster JSD=0.58-0.68; still improving, try 90M","timestamp":1779130875,"segment":1}
{"run":32,"commit":"e10bbe4","metric":0.146077,"metrics":{"mean_jsd":0.495410,"min_jsd":0.276933,"min_sp_return":0.235833,"mean_sp_return":0.294861,"n_collapsed":0,"mean_agreement":0.412240},"status":"discard","description":"LR=3e-4 90M — regressed from 75M (0.154→0.146); 75M confirmed as sweet spot for LR=3e-4","timestamp":1779132506,"segment":1}
{"run":33,"commit":"e10bbe4","metric":0.175423,"metrics":{"mean_jsd":0.497065,"min_jsd":0.272372,"min_sp_return":0.315833,"mean_sp_return":0.352917,"n_collapsed":0,"mean_agreement":0.419531},"status":"keep","description":"LR=2e-4 100M — new best! mean_sp=0.353 (+18%), composite=0.175; br5 at SP=0.430 (52% max), SP-XP gap=0.099; slower LR trend holds","timestamp":1779134284,"segment":1}
{"run":34,"commit":"7be49e6","metric":0.177689,"metrics":{"mean_jsd":0.482777,"min_jsd":0.215170,"min_sp_return":0.335000,"mean_sp_return":0.368056,"n_collapsed":0,"mean_agreement":0.446875},"status":"keep","description":"LR=2e-4 125M — new best composite=0.178, mean_sp=0.368; but clustering intensifying (br0/br4 agree 80%), min_jsd=0.215 declining","timestamp":1779136439,"segment":1}
{"run":35,"commit":"4e68618","metric":0.173838,"metrics":{"mean_jsd":0.487206,"min_jsd":0.260104,"min_sp_return":0.319167,"mean_sp_return":0.356806,"n_collapsed":0,"mean_agreement":0.426302},"status":"discard","description":"LR=2e-4 150M — regressed from 125M (0.178→0.174); 125M confirmed as LR=2e-4 sweet spot","timestamp":1779138933,"segment":1}
{"run":36,"commit":"4e68618","metric":0.159593,"metrics":{"mean_jsd":0.451146,"min_jsd":0.340557,"min_sp_return":0.318333,"mean_sp_return":0.353750,"n_collapsed":0,"mean_agreement":0.487760},"status":"discard","description":"TOLERANCE=0.2 LR=2e-4 100M — two-cluster trap broken! min_jsd=0.341 (vs 0.272 at TOL=0.1), SP held (0.354 vs 0.353), but composite lower (0.160 vs 0.175)","timestamp":1779140720,"segment":1}
{"run":37,"commit":"4e68618","metric":0.179072,"metrics":{"mean_jsd":0.515520,"min_jsd":0.342661,"min_sp_return":0.305000,"mean_sp_return":0.347361,"n_collapsed":0,"mean_agreement":0.395573},"status":"keep","description":"TOLERANCE=0.2 LR=2e-4 125M — new best! min_jsd=0.343 (vs 0.215 at TOL=0.1), cluster broken (max agree=60.2% vs 80.1%), SP cost tiny (-5.7%), mean_jsd=0.516","timestamp":1779142853,"segment":1}
{"run":38,"commit":"116a215","metric":0.173166,"metrics":{"mean_jsd":0.510983,"min_jsd":0.304133,"min_sp_return":0.299167,"mean_sp_return":0.338889,"n_collapsed":0,"mean_agreement":0.407031},"status":"discard","description":"TOLERANCE=0.2 LR=2e-4 150M — regressed from 125M (0.179→0.173); 125M confirmed as sweet spot for this config","timestamp":1779145368,"segment":1}
{"run":39,"commit":"116a215","metric":0.165237,"metrics":{"mean_jsd":0.475881,"min_jsd":0.213557,"min_sp_return":0.305833,"mean_sp_return":0.347222,"n_collapsed":0,"mean_agreement":0.432812},"status":"discard","description":"TOLERANCE=0.3 LR=2e-4 125M — clustering reformed (br_0/br_5 agree 80.5%), min_jsd=0.214; tolerance curve non-monotonic, 0.2 is optimal","timestamp":1779147531,"segment":1}
{"run":40,"commit":"116a215","metric":0.177204,"metrics":{"mean_jsd":0.405553,"min_jsd":0.276146,"min_sp_return":0.408333,"mean_sp_return":0.436944,"n_collapsed":0,"mean_agreement":0.546354},"status":"discard","description":"LR=1e-4 TOL=0.2 200M — incredible SP (mean_sp=0.437, min_sp=0.408!) but diversity regressed (min_jsd=0.276, br3/br4 agree 77.7%); 200M likely still improving, try 250M","timestamp":1779150788,"segment":1}
{"run":41,"commit":"116a215","metric":0.200684,"metrics":{"mean_jsd":0.461195,"min_jsd":0.324799,"min_sp_return":0.411667,"mean_sp_return":0.435139,"n_collapsed":0,"mean_agreement":0.425260},"status":"keep","description":"LR=1e-4 TOL=0.2 250M — NEW BEST 0.200! mean_sp=0.435, min_sp=0.412 (all teams >40% max!), min_jsd=0.325, SP-XP gap=0.198; JSD recovered from 200M dip","timestamp":1779154727,"segment":1}
{"run":42,"commit":"b6e4aab","metric":0.205532,"metrics":{"mean_jsd":0.461151,"min_jsd":0.348438,"min_sp_return":0.428333,"mean_sp_return":0.445694,"n_collapsed":0,"mean_agreement":0.403906},"status":"keep","description":"LR=1e-4 TOL=0.2 300M — new best 0.206! SP still improving (mean_sp=0.446, min_sp=0.428, all teams within 0.025), min_jsd=0.348; gaining rate slowing (+3%)","timestamp":1779159362,"segment":1}
{"run":43,"commit":"82b2a34","metric":0.223167,"metrics":{"mean_jsd":0.509610,"min_jsd":0.314712,"mean_sp":0.437917,"min_sp":0.397500,"n_collapsed":0,"mean_agreement":0.354687},"status":"keep","description":"LR=1e-4 TOL=0.2 350M — JSD jumped to 0.510, still accelerating","timestamp":1779164929,"segment":1}
{"run":44,"commit":"82b2a34","metric":0.208676,"metrics":{"mean_jsd":0.496520,"min_jsd":0.340627,"mean_sp":0.420278,"min_sp":0.388333,"n_collapsed":0,"mean_agreement":0.369271},"status":"discard","description":"LR=1e-4 TOL=0.2 400M — SP eroded by Lagrange pressure, composite regressed from 350M best","timestamp":1779171153,"segment":1}
